<?xml version="1.1" encoding="UTF-8" standalone="no"?>
<!DOCTYPE annuaire SYSTEM "Exercice2.dtd">



<annuaire>
    <personne>
        <nom>Orianne</nom>
        <prenom>Maya</prenom>
        <adresse>
            <rue>Rue d'Orianne</rue>
            <numero>1</numero>
            <boite>32</boite>
            <codePostal>1000</codePostal>
            <ville>Bruxelles</ville>
            <pays>Belgique</pays>
        </adresse>
        <telephones>
            <telephone>
                <typeNumero></typeNumero>
                <numero></numero>
            </telephone>
        </telephones>
        <emails>
            <email>
                <typeEmail>Perso</typeEmail>
                <adresseEmail>mayaorianne@gmail.com</adresseEmail>
            </email>
        </emails>
    </personne>
    <personne>
        <nom>Drzazgowska</nom>
        <prenom>Katarzyna</prenom>
        <adresse>
            <rue>Rue de Pologne</rue>
            <numero>32</numero>
            <boite>2</boite>
            <codePostal>1020</codePostal>
            <ville>Ixelles</ville>
            <pays>Belgique</pays>
        </adresse>
        <telephones>
            <telephone>
                <typeNumero></typeNumero>
                <numero></numero>
            </telephone>
        </telephones>
        <emails>
            <email>
                <typeEmail>Perso</typeEmail>
                <adresseEmail>mayaorianne@gmail.com</adresseEmail>
            </email>
        </emails>
    </personne>
</annuaire>